{
  "run_id": "LIOE-2026-0002",
  "case_id": "PR-97",
  "started_at": "2026-10-06T00:08:00+02:00",
  "finished_at": null,
  "record_origin": "LIVE_LIOE",
  "mission_profile": "L3_CONSEQUENTIAL",
  "problem_class": "lioe_runtime_observability_and_real_run_collection",
  "mode": "governance_engineering",
  "objective": "Implement the complete AI Advokat Legal Intelligence & Orchestration Engine, variable mission depth, evaluation, real Legal Run Records, baseline measurement and CI governance.",
  "jurisdictions": [
    "SYSTEM_GOVERNANCE"
  ],
  "specialist_agents": [
    "chief_legal_orchestrator",
    "verification_citation"
  ],
  "routing_reasons": {
    "chief_legal_orchestrator": [
      "owns user-facing orchestration and final synthesis"
    ],
    "verification_citation": [
      "mandatory verification of governance and source/version boundaries"
    ]
  },
  "sources": [
    "/architecture/AI_ADVOKAT_LEGAL_OPERATING_PROTOCOL.md",
    "/data/legal-operating-protocol-v1.json",
    "/data/agent-architecture-v2.json",
    "/data/human-gate-decision-ledger.json",
    "https://github.com/ai-advokat/ai-advokat.github.io/pull/97",
    "https://github.com/ai-advokat/ai-advokat.github.io/actions/runs/37382628931",
    "https://github.com/ai-advokat/ai-advokat.github.io/actions/runs/37382628971"
  ],
  "source_verification_state": "VERIFIED",
  "current_law_claim_material": false,
  "temporal_verification_state": "NOT_REQUIRED",
  "jurisdiction_verification_state": "NOT_REQUIRED",
  "human_review_state": "PENDING",
  "required_gate_types": [
    "github_merge"
  ],
  "gate_decisions": {
    "github_merge": "pending"
  },
  "implementation_state": "STAGED",
  "rollback_reference": "e70f8b2bc6419dd89441a57cf811ee70e4778784",
  "legal_stress_test_state": "PASSED",
  "adversarial_review_state": "PASSED",
  "verification_state": "PASSED",
  "outcome_state": "PARTIAL_SUCCESS",
  "release_status": "READY_FOR_MERGE",
  "first_pass_verification": false,
  "verification_attempts": 2,
  "correction_required": true,
  "learning_candidates": [
    "Focused LIOE governance CI must fetch full Git history before comparing the PR base SHA for diff hygiene."
  ],
  "provider_or_tool_failures": [],
  "fallback_mode": "NONE",
  "data_classification": "PUBLIC",
  "elapsed_ms": null,
  "tool_calls": null,
  "measured_cost": null,
  "metric_eligibility": {
    "effectiveness": false,
    "time": false,
    "activation": false,
    "tooling": false,
    "cost": false
  },
  "measurement_notes": [
    "Live record opened while the LIOE implementation mission is in progress.",
    "The record will not be closed as SUCCESS unless executable CI verification and the named GitHub merge gate are both evidenced.",
    "First focused LIOE CI attempt passed syntax, JSON governance, unit tests, Chief Orchestrator integration, all 9 canonical legal eval cases and both real-run record checks; the job failed only because shallow checkout made the base-SHA diff unavailable.",
    "Second CI iteration passed all six PR checks: security tests, activation safety, LIOE governance, corpus safety, membership safety and relevance safety."
  ]
}
